<?xml version="1.0" encoding="UTF-8"?>
<!--  PUBLIC - from online or from any other resources -->
<!DOCTYPE students SYSTEM "external.dtd"[

<!ENTITY KLU "KL University">

]>
<students> 

<student>
<id>&apos;1900300001&apos;</id>
<name>Sravani</name>
<gender>Female</gender>
<department>CSE</department>
</student>

<student>
<id>1900300002</id>
<name>PEACE</name>
<gender>female</gender>
<department>CSE</department>
</student>

<student>
<id>1900300003</id>
<name>&KLU;</name>
<gender>female</gender>
<department>ECE</department>
</student>

</students>